{
  "schema": "lighthouse-status/v1",
  "repository": "LighthouseRobotics/lighthouse",
  "status": "active",
  "summary": "Shared contracts: lighthouse-bundle/v1 with Python and JS verifiers; Sites security baseline helpers; local CI receipts (lighthouse-ci-receipt/v1); one status line per repository (lighthouse-status/v1).",
  "lastVerified": "2026-10-14",
  "verifiedBy": "scripts/check.sh (local; hosted CI is blocked by account billing)",
  "nextAction": "Adopt the bundle envelope in one producer (Manta photo packages are the closest fit), the security baseline in Summit, and ci-local receipts in PR bodies.",
  "blockers": [],
  "startHere": "README.md"
}
